,id,title,overview,poster_path,video_key
508,19913,500일의 썸머,"자신의 인생을 바꿔줄 운명적인 사랑이 나타날 것이라 믿는 순수청년 톰. 어느 날 사장의 새로운 비서로 나타난 썸머를 처음 보는 순간 강렬한 스파크를 일으키며 자신의 반쪽임을 직감한다. 이후 대책없이 썸머에게 빠져드는 톰. 그녀에게 접근하기 위한 부단한 노력에도 불구하고 사랑도 남자친구도 눈꼽만큼도 믿지 않고 구속받기 싫어하는 썸머로 인해 그냥 친구 사이로 지내기로 하지만, 둘의 사이는 점점 그 이상의 관계로 발전하게 된다. 그녀를 천생연분이라 확신하는 톰. 이제 둘 관계의 변화를 위한 선택이 필요한 순간이 다가오는데...",/jXFTwKzM1YVek4999NuTUjIHiIu.jpg,m5bHFoU4F0w
509,760336,뮌헨: 전쟁의 문턱에서,"1938년, 긴장이 흐르는 뮌헨 회담. 각자의 정부를 대표하여 서로의 맞은편에 앉은 두 옛 친구는 어쩔 수 없이 첩보 활동에 발을 담근다. 나치 독일의 비밀을 알려야 하기에.",/1SOiUTDnwW9gU4GzSIsOCQUlHJF.jpg,w5rhad3d4zo
510,600583,파워 오브 도그,"사람들을 억누르면서도 사람들을 끌어당기는 묘한 매력의 목장주. 그의 동생이 새로운 부인과 아들을 집으로 데려오자, 그들을 잔인하게 조롱하고 괴롭힌다. 예상치 못한 일이 그곳을 덮칠 때까지.",/fCoAzzfXniaYzz4JcFWT5yZmXh9.jpg,9C5Dy7uOfFE
511,923632,데이트 앱 사기: 당신을 노린다,"전 세계를 여행하는 부유한 다이아몬드 사업가 행세를 한 남자. 온라인에서 만난 여성들의 마음을 훔치고, 그들에게서 수백만 달러에 달하는 돈을 사취했다. 이제 피해자들이 복수를 위해 뭉쳤다.",/iLUSFjdavIf0SrP7ldoQ1xomQVC.jpg,zqHRuUKHPdk
512,587496,더 렌탈: 소리없는 감시자,"연인 ‘찰리’와 ‘미셸’은 동생 커플과 함께 오리건 해변의 멋진 뷰가 있는 렌탈 하우스로 휴가를 떠난다. 즐거운 시간을 보내는 한편, 완벽해 보이는 집에서 불쾌하고 낯선 시선을 느낀 네 사람은 누군가에게 감시 당하고 있다는 의심을 품게 되고, 숨겨둔 비밀이 하나 둘 드러나기 시작하는데...",/2dfSea7uFSUNsFhCWvy4N8UfF7d.jpg,iRhc47hps94
513,649928,로빈 로빈,"쥐들이 키워낸 새 한 마리. 어느 날 그 새가 의문을 품는다. 내가 있을 자리는 진정 어디일까. 그렇게 자신을 찾아, 용감한 여정이 시작된다. 스톱모션 기법의 단편영화.",/bKIdlJbd17rrIm4oZzhXTbmqpon.jpg,JUX0lFr0ZFI
514,522931,킬러의 보디가드 2,"킬러 다리우스(사무엘 L. 잭슨)를 호송하느라 경호 면허를 잃게 된 마이클(라이언 레이놀즈)은 스트레스로 인해 정신과 상담마저 받아야 하는 상황. 침착하게 마음을 달래며 명상의 삶을 살려던 그의 앞에 난데없이 다리우스와 결혼했다고 주장하는 킬러의 아내 소니아(셀마 헤이엑)가 나타난다. 절대 총을 들지 않겠다면서 자발적 안식년을 주장하는 마이클은 소니아에게 반강제로 이끌려 다리우스 구출 작전에 합류하게 되고, 그와 동시에 그리스의 혁명적 부활을 꿈꾸는 악당 아리스토텔레스(안토니오 반데라스)에게도 쫓기게 되는데...",/5DriFIGybBjdTR27oz1hrt5zpig.jpg,QuyIafD7DJM
515,359724,포드 V 페라리,"1960년대, 매출 감소에 빠진 포드는 판매 활로를 찾기 위해 페라리와의 인수 합병을 추진한다. 막대한 자금력에도 불구, 계약에 실패하고 엔초 페라리로부터 모욕까지 당한 헨리 포드 2세는 르망 24시간 레이스에서 페라리를 박살 낼 차를 만들 것을 지시한다. 지옥의 레이스로 불리는 르망 24시간 레이스. 출전 경험조차 없는 포드는 대회 6연패를 차지한 페라리에 대항하기 위해 르망 우승자 출신 자동차 디자이너 캐롤 셸비를 고용하고, 그는 누구와도 타협하지 않지만 열정과 실력만큼은 최고인 레이서 켄 마일스를 자신의 파트너로 영입하는데...",/wBUoWL4z0nsvC9cYT3VCc74X3jE.jpg,aGuNdxPTeis
516,675327,섀도우 클라우드,제2차 세계대전 중 최고 기밀이 들어있는 가방을 가진 여성 조종사가 폭격기에 탑승하고 승무원들은 그녀의 신원과 의문의 화물에 대해 의심하는 가운데 비행 중에 사악한 존재를 만나게 된다.,/9qY1Ubtf1CwA8Qzz1Y0cujVi7bc.jpg,tC539tiy4QA
517,501170,닥터 슬립,"어린시절 아버지가 남긴 트라우마에서 벗어나지 못한 대니는 자신이 가진 샤이닝 능력으로 죽음을 앞둔 이들을 돕는 닥터 슬립으로 불리며 살고 있다. 우연히 누구보다 강력한 샤이닝 능력을 지닌 12살 소녀 아브라 스톤을 만나게 되면서, 샤이닝 능력자들을 먹고 영원한 생명을 이어나가는 트루 낫이라는 비밀조직과 맞서게 되는데…",/zcXjQEHfwuHrZKzpbrCPGnpPNtk.jpg,n-Gc-dMOXmE
518,475215,미래의 미라이,"엄마와 아빠, 그리고 사랑스러운 강아지 ‘윳코’, 너무너무 좋아하는 기차 장난감들이 있는 나만을 위한 놀이방과 작은 정원. 세상 행복한 삶을 살고 있던 네 살 ‘쿤’에게, 첫 눈이 오던 날 동생 ‘미라이’가 찾아온다! 여동생과의 첫 만남, 신비로운 순간도 잠시… 부모님의 관심은 온통 ‘미라이’에게 향하고, ‘쿤’은 인생 최초 위기감(!)과 설움을 느끼게 된다. 그러던 어느 날 ‘쿤’에게 미래에서 온 소녀 ‘미라이’가 찾아오게 되는데! ‘쿤’의 작은 정원에서 아주 특별한 여행이 시작된다!",/9EQNvSZTvAw8GBfenKmLhbnDLD5.jpg,ZfuS_37LwMc
519,242582,나이트 크롤러,"루이스는 우연히 목격한 교통사고 현장에서 사건 현장을 카메라에 담아 TV 매체에 고가에 팔아 넘기는, 일명 나이트 크롤러를 보게 된다. 경찰이 도착하기 전에 빠르게 나타나 현장을 스케치하고 전화를 통해 가격을 흥정하는 그들에게서 묘한 돈 냄새를 맡은 루이스는 즉시 캠코더와 경찰 무전기를 구입하고 사건현장에 뛰어든다. 유혈이 난무하는 끔찍한 사고 현장을 적나라하게 촬영해 첫 거래에 성공한 루이스는 남다른 감각으로 지역채널의 보도국장 니나의 적극적인 지지를 받게 된다. 매번 더욱 더 자극적이고 충격적인 뉴스를 원하는 니나와 그 이상을 충족 시켜주는 루이스는 최상의 시청률을 만들어내며 승승장구한다. 자신의 촬영에 도취된 루이스는 결국 완벽한 특종을 위해 사건을 조작하기에 이르는데...",/wVflplL5OMy8nD1Z7gM64lIRvwa.jpg,aTbOOaKUGL4
520,644092,알로하! 오하나를 찾아서,"우리 고향은 뉴욕인데? 할아버지가 사는 오아후섬으로 간 남매. 그들은 사라진 보물을 찾는 아찔한 모험을 하며 깨닫는다. 하와이가 어떤 곳인지, 가족이 얼마나 소중한지.",/tTWl37oAYRXS3D5mEHmjveXXyrN.jpg,_9Z249FlX-w
521,353081,미션 임파서블: 폴아웃,"에단 헌트는 세계를 위협하는 테러 조직 신디케이트의 수장 솔로몬 레인을 우여곡절 끝에 체포했지만, 그의 잔당들은 여전히 세계 각지에서 테러를 일삼는다. 에단 헌트와 그의 팀은 테러조직의 핵무기 소지를 막기 위해 미션에 착수한다. 에단 헌트는 작전 수행 중 예상치 못한 결단을 내리게 되고, 중앙정보국 CIA는 그를 견제하기 위해 상급 요원 어거스트 워커를 파견한다. 최악의 테러 위기와 라이벌의 출현 속, 팀이 행한 모든 선의의 선택들이 최악의 결과로 돌아오면서 미션은 점점 더 예측할 수 없는 상황으로 치닫게 되는데...",/tKAlw88sEjU5bntbAfdfWcmRx6S.jpg,AWtqXQfT_HU
522,381284,히든 피겨스,"천부적인 수학 능력을 가진 캐서린 존슨, NASA 흑인 여성들의 리더이자 프로그래머 도로시 본 , 흑인 여성 최초의 NASA 엔지니어를 꿈 꾸는 메리 잭슨. 미국과 러시아의 치열한 우주 개발 경쟁이 벌어지고 있던  시절, 천부적인 두뇌와 재능을 가진 그녀들이 NASA 최초의 우주궤도 비행 프로젝트에 선발된다. 하지만 유색인종 전용 화장실을 사용해야 하고, 중요한 회의에 참석할 수 없으며, 공용 커피 포트조차 용납되지 않는 따가운 시선에 점점 지쳐 간다. 한편 프로젝트는 난항을 겪게 되고, 해결 방법은 비전을 제시할 수 있는 새로운 수학 공식을 찾아내는 것뿐인데...",/wZPcpIyZx43nXEgrc9NvQUyoxtr.jpg,ItSUOpH4A5w
523,481084,아담스 패밀리,"고메즈와 모티시아는 결혼식 도중에 결혼을 반대하는 사람들에게 쫓겨 달아나다가 우연히 버려진 성을 발견한다. 으스스한 그 곳을 집으로 삼고 딸 웬즈데이와 아들 퍽슬리를 키우며 살아간다. 어느 날, 아담스 가족은 평범한 동네를 방문하게 되고 사람들은 그들의 기괴한 모습과 행동에 기겁하며 달아난다. 웬즈데이가 그 동네의 학교를 다니게 되면서 파커와 친구가 되어 서로 변해 가기 시작한다. 파커의 엄마는 이상하게 달라진 파커의 모습에 아담스 가족을 괴물로 몰아가며 괴롭히기 시작한다.",/fykFaD4flUkSHZsWACnjg9Uw6eR.jpg,WzoU2ydEbv0
524,20453,세 얼간이,"천재들만 간다는 일류 명문대 ICE, 성적과 취업만을 강요하는 학교를 발칵 뒤집어 놓은 대단한 녀석 란초! 아버지가 정해준 꿈, ‘공학자’가 되기 위해 정작 본인이 좋아하는 일은 포기하고 공부만 하는 파파보이 파르한! 찢어지게 가난한 집, 병든 아버지와 식구들을 책임지기 위해 무조건 대기업에 취직해야만 하는 라주! 친구의 이름으로 뭉친 ‘세 얼간이’! 삐딱한 천재들의 진정한 꿈을 찾기 위한 세상 뒤집기 한판이 시작된다!",/9zQdFVyDoXqFmGYXp4obna6FEMh.jpg,1_m4nB7tscA
525,8392,이웃집 토토로,"1955년 일본의 아름다운 시골 마을, 상냥하고 의젓한 11살 사츠키와 장난꾸러기에 호기심 많은 4살의 메이 는 사이좋은 자매로 아빠와 함께 도시를 떠나 시골로 이사온다. 자상한 아빠 쿠사카베타츠오는 도쿄에서 대학 연구원이며, 입원 중이지만 따뜻한 미소를 잃지 않는 엄마가 있다. 곧 퇴원하실 엄마를 공기가 맑은 곳에서 맞이하기 위해서다. 숲 한복판에 금방이라도 쓰러질 것처럼 낡은 집을 보며 자매는 새로운 환경에 대한 호기심으로 잔뜩 들뜬다. 그러던 어느 날 사츠키가 학교에 간 동안 메이는 숲에서 정령을 만나다. 메이는 그 정령에게 토토로란 이름을 붙여주는데...",/csiklRMzvXRLKtFcIlEDeEU7nWr.jpg,8LLmvVSnYiw
526,522406,플래시백,"단조로운 일상에 지친 직장인 ‘프레드릭'. 어느 날 길에서 마주친 낯선 남자에게서 데자뷔를 느낀 뒤 기억 저편에 묻어두었던 고등학생 시절 첫사랑 '신디'를 떠올린다. 신디가 졸업 시험을 앞두고 갑자기 사라졌다는 사실을 알게 된 프레드릭은 그의 실종이 친구들과 호기심에 삼킨 금지된 약 '머큐리'와 깊이 연관되어 있음을 직감한다. “나는 과거의 기억인가, 미래의 환영인가” 과거와 미래의 경계에 갇힌 프레드릭의 마지막 선택!",/oMbzioE5JfriNbjd4oQBHL7wNDF.jpg,vIl2jFnl6Ro
527,623491,사탄의 베이비시터: 킬러 퀸,베이비시터 비와 악마 숭배 집단을 물리치고 2년이 지났다. 과거를 잊으려고 애쓰는 콜. 고등학교에서 살아남는 일만으로도 아주 죽을 맛이다. 하지만 이게 무슨 날벼락. 그 옛날 적들이 돌아오다니! 콜은 다시 한번 악의 무리를 퇴치해야 한다.,/imy1OoT1xddt2kqw6hhc4v01e8i.jpg,Skfr1ChMBEQ
528,76285,퍼시 잭슨과 괴물의 바다,"신과 인간 사이에서 특별한 능력을 가지고 태어난 데미갓들이 모여 훈련 받는 데미갓 캠프. 어느 날, 사악한 신들의 아버지 크로노스가 봉인을 풀고 부활해 신과 인간 세상을 파멸시키려 한다. 이 때문에 데미갓 캠프는 위험에 빠지게 되고, 이에 퍼시는 아나베스, 그로버, 타이슨과 함께 신과 인간 세상을 구원하기 위해 괴물의 바다에 숨겨진 마법의 황금 양피를 찾기 위한 위험천만한 모험을 떠난다.",/xcbsTDfVjGIQLlyHD4jhIQOV8zt.jpg,xmAsf7Os1Bk
529,81005,잭 더 자이언트 킬러,"‘클로이스트’의 시골 농장에서 삼촌과 함께 살고 있는 잭(니콜라스 홀트)은 시장에 말을 팔러 갔다가 돈 대신 콩 몇 알을 얻게 된다. 그날 밤 잭의 집으로 세찬 비바람을 피해 낯선 손님 이자벨(엘리너 톰린슨)이 찾아온다. 그리고 우연히 잭이 낮에 얻어온 콩이 물에 젖어 하늘로 뻗어 오르면서, 공주 이자벨은 엄청나게 자라는 마법의 콩나무에 휩쓸려 하늘과 땅 사이에 존재하는 무시무시한 거인들의 세상 ‘간투아’로 사라지게 된다.  이 사건을 계기로 인간들의 세계와 무시무시한 거인들의 세계가 연결되고, 오래 전 추방당했던 거인들은 그들이 잃었던 땅을 되찾기 위해 봉기한다. 그리고 잭은 이자벨을 구하고 인간세계를 정복하려는 거인들에 맞서는 거대한 전쟁에 합류하게 되는데...",/gOl2NW28GR0LTYILvzI0b6zpsrS.jpg,TXQIhaImfUY
530,329865,컨택트,"어느 날 전 세계 12개 지역에 외계 비행물체 셸이 동시다발로 출현한다. 450m에 달하는 거대 비행체가 가만히 서 있을 뿐 어떤 행동도 하지 않자 각국 정부는 각자의 방식으로 외계인과 접촉을 시작하지만, 완전히 다른 언어 체계 때문에 첫 단계부터 난항을 겪는다. 미국 정부의 요청을 받은 언어학자 루이스와 물리학자 이안은 말과 글이 통하지 않는 상황에서, 신체의 모든 기관과 감정을 이용해 미지의 생명체와 대화를 시도하고 서로의 문자를 배워나간다. 마침내 대화의 물꼬가 트이게 되지만 그때부터 루이스는 이해하기 어려운 환상을 연이어 보기 시작하는데...",/1jhYawjt748tAkuk2DzJJafvI2V.jpg,x-StGEpXeSw
531,13004,다이아몬드 성의 바비,"리아나와 알렉사는 깊은 숲 속에 있는 작은 오두막에 살고 있어요. 둘은 꽃을 가꾸고 노래를 사랑하는 예쁜 소녀들이죠. 어느 날, 멜로디라는 소녀가 마법으로 갇힌 거울을 손에 넣은 리아나와 알렉사는 새로운 친구를 위해 비밀의 다이아몬드 성으로 향하는 위험한 여행을 시작합니다. 둘의 우정을 시험하는 많은 난관과 위험 속에서 쌍둥이 형제 이안과 제레미, 그리고 귀여운 강아지 스푸키와 릴리를 만나게 됩니다. 리아나와 알렉사는 비밀의 다이아몬드 성을 찾을 수 있을까요? 우정을 위해 사악한 리디아와 맞선 두 소녀의 용기 있는 모험속으로 함께 떠나요~",/dvjFM3GgYm3gDZ6Ulw0JurDYs4r.jpg,Sn9itQQ94qo
532,74,우주전쟁,"레이 페리어는 이혼한 항만 근로자로 아무런 희망 없이 매일을 살아간다. 그러던 어느 주말, 그의 전 부인은 아들 로비와 어린 딸 레이첼과 주말을 보내라고 레이에게 맡긴다. 그리곤 얼마 안 있어 강력한 번개가 내리친다. 잠시 후, 레이는 그의 집 근처에 있는 교차로에서 그들의 삶을 영원히 바꾸어버릴 엄청난 사건을 목격하게 된다. 커다랗고 다리가 셋 달린 정체 불명의 괴물이 땅속 깊은 곳에서 나타나 사람들이 미처 반응도 하기 전에 모든 것을 재로 만들었다. 평범했던 하루가 갑자기 외부의 알 수 없는 침략자들의 첫 번째 지구 공격으로 그들 인생에서 가장 엄청난 사건이 일어난 날이 되어버린 것이다. 레이는 그의 아이들을 이 무자비한 새로운 적들로부터 보호하기 위해 급히 피난을 떠나, 파괴되고 황폐해진 도시를 가로지르는 여정에 오른다. 거기서 그들은 침략자들을 피하기 위해 필사적으로 도망치는 피난민들을 만나 합류하게 된다. 그러나 그들이 어디로 가든지 안전한 곳은 없고, 피난처도 없다. 단지 소중한 사람을 지켜내겠다는 레이의 확고한 의지만 존재 할 뿐인데…..",/f4JdjFJmyc76L5tjjdCOIQuzCZo.jpg,bszKeSeDsbs
533,785752,침입자,꿈의 집에 살기 위해 시골 마을로 이사한 부부. 괴한의 침입 이후 아늑했던 집이 생지옥처럼 느껴진다. 침입자에 대해 조사하던 아내 앞에 던져진 소름 돋는 사실. 공포는 지금부터 시작이다.,/o6ozTBflWXlBje0uxJv4m6s4HTq.jpg,i9tiHlt3otI
534,9880,프린세스 다이어리,"미아는 샌프란시스코의 고등학생이다. 영리하지만 수줍음을 많이 타는 미아는 미술가인 어머니 헬렌과 단 둘이 산다. 남들처럼 미아도 로맨틱한 사랑을 꿈꾸지만 부스스한 외모와 수줍음 때문에 친구들로부터 항상 따돌림을 받는다. 그런 그녀에게 뜻밖의 소식이 날아든다. 평생 연락을 끊고 살 줄 알았던 할머니가 온다는 소식이었다. 게다가 할머니는 제노비아라는 나라의 여왕이라고 하지 않는가! 그럼 미아의 신분은?!  세상에나! 남학생들로부터 눈길 한 번 받아보지 못했던 미아는 제노비아의 왕위를 이어갈 공주였던 것이다. 제노비아의 왕자였던 미아의 아버지는 오래 전 어머니와 이혼했고, 미아의 어머니나 할머니도 미아의 장래를 위해서 성인이 되기 전까지는 그녀에게 신분을 알려주지 않기로 했던 것이다. 자신이 공주라는 사실이 믿기지 않는 미아는 갈등에 빠진다. 금붕어 한 마리도 제대로 키우지 못하는 자신이 나라를 통치해야 된다는 사실을 어찌 간단하게 받아들일 수 있을까!  어머니의 설득으로 미아는 제노비아의 독립기념일 무도회 직전까지 공주 레슨을 받기로 하고, 공주가 되느냐 마느냐는 그 후 결정하기로 했다. 그녀의 얼굴과 모습은 빛나는 보석처럼 눈부시게 아름다워지고, 학교에서도 모든 남학생의 시선을 사로잡는다. 그 뿐 아니라 입이 가벼운 미용사 때문에 미아의 비밀이 공개되면서 언론의 카메라 세례를 한 몸에 받게 된다. 그러면서 가장 가까웠던 단짝 친구인 릴리와는 차츰 사이가 멀어진다. 결국, 미아의 갈등이 더욱 심해지는 가운데 해변에서 있었던 미아의 로맨스 장면이 대서특필 되는 사건까지 터지는데... 과연 미아는 제노비아의 독립 기념 무도회 때 어떤 선언을 하게 될지...",/4TPgVxEKTXZ8KQzv9JOp956DOg6.jpg,w41210A6wOU
535,87827,라이프 오브 파이,"인도에서 동물원을 운영하던 ‘파이’의 가족들은 정부의 지원이 끊기자 캐나다로 이민을 준비한다.  동물들을 싣고 캐나다로 떠나는 배에 탑승한 가족들.  하지만 상상치 못한 폭풍우에 화물선은 침몰하고 가까스로 구명선에 탄 파이만 목숨을 건지게 된다.  구명 보트에는 다리를 다친 얼룩말과 굶주린 하이에나,  그리고 바나나 뭉치를 타고 구명보트로 뛰어든 오랑우탄이 함께 탑승해 긴장감이 감돈다.  하지만 이들 모두를 놀라게 만든 진짜 주인공은  보트 아래에 몸을 숨기고 있었던 벵갈 호랑이 ‘리처드 파커’!  시간이 갈수록 배고픔에 허덕이는 동물들은 서로를 공격하고  결국 리처드 파커와 파이만이 배에 남게 된다.  파이는 배에서 발견한 생존 지침서를 바탕으로  점차 ‘리처드 파커’와 함께 바다 위에서 살아가는 법을 습득하게 된다.  그리고 태평양 한가운데서..  집채 만한 고래와 빛을 내는 해파리, 하늘을 나는 물고기, 그리고 미어캣이 사는 신비의 섬 등  그 누구도 보지 않고서는 믿을 수 없는 놀라운 사건들을 겪게 되는데…!",/5AFKp85Bka4mQeaeVNs3evyMYYE.jpg,JlZV4Ietg5M
536,211672,미니언즈,"인류가 탄생하기 훨씬 오래 전, 태초에 미니언이 있었다. 당대 최고의 슈퍼 악당만을 보스로 섬겨온 미니언들! 하지만 의도치 않은 치명적(?) 실수로 인해 보스들과 이별하게 되고, 우울증에 빠진 미니언들을 구하기 위해 용감한 리더 ‘케빈’은 자유로운 영혼 ‘스튜어트’와 무한 긍정 ‘밥’과 함께 ‘슈퍼배드 원정대’를 결성한다. 세계 악당 챔피언십에 참석해 최초의 여성 슈퍼 악당 ‘스칼렛’(산드라 블록)을 보고 첫눈에 홀~딱 반한 이들은 일생일대의 위기가 다가오는지도 모른 채 스칼렛의 특급 미션을 넙죽 받게 되는데…",/bkWrtIS7vscRvK074BWn6WHuwuf.jpg,kfia-6BdA_w
537,58574,셜록 홈즈: 그림자 게임,"더욱 강렬하게, 더욱 스릴 있게 세상을 구할 홈즈의 추리가 다시 시작된다!  왓슨과 더 많은 시간을 보내기 위해 왓슨의 부인과 경쟁하는 홈즈 앞에 또 한 번 세상에서 가장 명석한 두뇌를 증명할 과제가 주어진다! 셜록 홈즈는 유럽에서 발생하는 연쇄 폭탄 테러사건, 강대국들의 전쟁 위기고조, 미국 철강 왕의 죽음 등 전세계에서 벌어지는 풀리지 않는 사건들이 모두 연결되어 있고 그 배후에 평생의 숙적 모리아티 교수(자레드 해리스)의 더 큰 음모가 숨겨져 있음을 직감한다.  조사 과정에서 만나게 된 집시이자 점술가인 묘령의 프랑스 여인 심(노미 파라스)을 통해 살인사건에 대해 정보를 얻지만 이를 계기로 여인은 킬러의 다음 목표물이 된다. 이에 홈즈는 그녀의 목숨을 구하기 위해, 그녀는 죽음을 피하기 위해 홈즈에게 협조하고 대륙을 넘나드는 험난한 모험 앞에서 교활한 모리아티 교수는 항상 한 발 먼저 죽음의 덫을 놓고 기다린다.  모리아티 교수의 계획이 성공하게 되면 역사가 뒤바뀔 정도로 세상은 위험해진다.  거대한 음모에 맞선 홈즈의 활약이 다시 펼쳐진다!",/vD1HZvrPW9FoYQFGr0ADTCsNFau.jpg,N57Csxg9Ebw
538,494407,포켓몬스터 극장판 - 모두의 이야기,"바람 축제에 온 지우와 피카츄. 이브이를 찾는 리사와 새로 만난 친구들과 함께 하던 중, 갑자기 모든 바람이 사라지고 정체를 알 수 없는 검은 연기가 마을을 뒤덮는다. 사람과 포켓몬 모두가 위험해질 위기가 찾아오자, 바람을 되찾기 위해 지우와 피카츄, 리사와 이브이, 라르고, 카가치, 히스이, 토리토의 모두가 함께하는 기적 같은 이야기가 시작된다.",/kFbN0FmDQGTt5q6HW3t7p1Yv8a3.jpg,7OqMwgNhSSM
539,419430,겟 아웃,크리스와 그의 여자친구 로즈는 주말을 맞아 로즈의 부모님 집을 방문한다. 가족들의 과한 친절이 그저 딸이 흑인 남자친구를 데려왔기 때문이라고 생각한 크리스. 하지만 머무는 시간이 길어질수록 이상한 점을 한 두가지씩 발견하는데... 그가 상상도 못한 진실이 기다리고 있었다.,/ajHgWxJENrSoysd2ZD7cJliKSoF.jpg,bz2GpORaNEg
540,479455,맨 인 블랙: 인터내셔널,자신의 모습을 감추고 오랜 시간 지구를 위협해 온 외계인을 감시하는 MIB 본부. MIB 본부에도 변화가 요구되면서 신입요원 에이전트 M이 영입되고 MIB 에이스 요원 에이전트 H가 듀오로 결성 된다. 그들에겐 MIB 내부의 스파이를 찾아야 하는 전대미문의 미션이 주어지는데…,/iCKqGR8PhD99yEJJ476JnW2cZSq.jpg,yihIQ4T4uiM
541,105,빽 투 더 퓨쳐,"마티 맥플라이(마이클 J. 폭스)는 평범한 고등학생이다. 그런데 평소 친하게 지내던 괴상한 발명가 에메트 브라운 박사(크리스토퍼 로이드)가 스포츠카 드로리안을 개조해 타임머신을 만들고, 뜻밖의 사고로 브라운 박사가 테러범들에게 총을 맞고 위험해진 상황에서 마티는 30년 전으로 가게 된다. 극장 간판에는 2류 배우인 로널드 레이건이 보이고 청년인 아버지와 어머니를 보게 된다. 젊은 아버진 멍청하고, 어머니는 미래의 아들인 마티를 좋아해 야단이다. 마티가 미래로 가는 것을 도와 줄 사람은 30년 전인 젊은 브라운 박사뿐인데...",/7gGicAJdHRzaUd6qLjH5bSW4Cgi.jpg,qiAB9R3TOK8
542,1691,호스텔 2,"쾌락을 찾아서, 죽음을 맞으러, 여행을 떠난다!  베스와 휘트니, 그리고 로나는 동유럽 여행 중 우연히 만난 모델 엑셀의 제안으로 슬로바키아의 한 호스텔에 가게 된다. 호스텔의 주인은 그 지역의 수확제에 참가 할 것을 제안하고, 은밀히 그들의 여권 사진과 정보를 각지 고객들에게 보낸다. 헌팅 클럽의 고객들은 살인할 대상을 차지하기 위한 치열한 경매를 펼친다. 한편 토드와 스튜어트는 낙찰받은 여자들을 죽이기 위해 슬로바키아로 오는데...",/4vypgqZRaVpeMDyjqCJSUNKSAeU.jpg,8fGUc-gIXJU
