,id,title,overview,poster_path,video_key
191,557,스파이더맨,"평범하고 내성적인 고등학생 피터 파커는 우연히 방사능에 감염된 거미에 물린다.그 후, 피터는 손에서 거미줄이 튀어 나오고 벽을 기어 오를 수 있는 거미와 같은 능력을 갖게 된다. 다가오는 위험을 본능적으로 감지하는 초감각과 엄청난 파워를 소유하게 된 것이다. 피터는 짝사랑하던 메리 제인의 관심을 끌기 위해 멋진 스포츠카를 구입하는데 초능력을 처음 사용한다. 그러다 사랑하는 벤 아저씨의 죽음을 계기로 그 힘을 악의 세력에 대항하는데 쓰기로 결심한다. 한편 피터의 절친 해리 오스본의 아버지인 노만은 실험 도중 가스에 중독되어 악의 화신 그린 고블린으로 변하는데...",/eXbCqcUsUDUq2qqGmU5i20S0tjo.jpg,WMxTe3eouQc
192,662708,"포켓몬스터 극장판 정글의 아이, 코코","포켓몬의 손에서 자라 자신이 포켓몬이라 믿는 소년 코코가 지우, 피카츄와 친구가 되면서 새로운 모험을 시작한다는 이야기.",/duRFn8VwYrZbgvaxatJ2qyE1Lhe.jpg,lhPaeBwuHnU
193,10198,공주와 개구리,"1930년대 미국 뉴올리언스. 티아나(애니카 노니 로즈)는 밤낮없이 아르바이트를 뛰며 돈을 모은다. 일찍 돌아가신 아빠(테렌스 하워드)의 꿈이었으며 이제는 그녀 본인의 목표가 된 뉴올리언스 최고의 레스토랑을 열기 전까지, 그녀에겐 연애할 시간도 없다. 그러다가 우연히 사악한 부두마법사 파실리에(키스 데이비드)에게 휘말려 개구리로 변해버린 나빈 왕자(브루노 캠포스)를 마주친다. 키스 한번이면 개구리가 왕자로 변한다는 공식을 믿고 티아나는 나빈에게 키스하지만 오히려 티아나까지 개구리로 변해버리는데...",/ofSiOQRqsFzkgw3DEwEWXjaMr9s.jpg,QQ-ArFD0BQs
194,72545,잃어버린 세계를 찾아서 2: 신비의 섬,"숀(조쉬 허처슨)은 며칠 전 밤부터 어디에선가 보내온 모스 부호를 받게 된다. 양아버지인 행크(드웨인 존슨)와 알 수 없는 부호들을 추적하다가 마침 내 그 뜻을 알게 된다. 반복적으로 계속되는 단어 “핍, 조른, 스트럭스”는 쥘 베른 소설 [해저 2만리]의 주인공들, 그리고 이어지는 신호는 이야기한다. “섬은 진짜 있다!”  마치 암호처럼 스티븐슨의 ‘보물섬’, 스위프트의 ‘걸리버 여행기’가 단서로 던져지고, 세 개의 책 속에 등장하는 섬들이 어쩌면 같은 곳일지도 모른다는 추측으로 세 개의 지도를 겹치자 경도와 위도가 적힌 좌표가 발견된다. 그것은 바로 ‘쥘 베른’의 추종자로 반평생 신비의 섬을 찾아 다니던 할아버지가 보낸 신호였고, 2년 전 연락이 끊긴 할아버지를 찾아 신비의 섬으로 출발한다.  섬 여행 안내인이자 헬리콥터 파일럿인 가바토(루이스 구즈만)와 그의 아름다운 딸 카일라니(바네사 허진스)가 이 대열에 합류하면서 그들의 여정은 시작된다. 헬기를 타고 섬을 향해 가던 일행은 강력한 태풍을 만나고, 지도에 의하면 태풍의 눈에 들어가야만 섬에 갈 수 있다는데!!  폭풍우에 휩싸여 추락한 뒤 도착한 곳은 세상에 알려지지 않은 신비로운 섬 ‘아틀란티스’! 환상적인 생물들과 황금산이 장관을 이루는 아름다운 이 곳에서 마침내 반평생 신비의 섬을 찾아 다니던 숀의 할아버지 알렉산더(마이클 케인)를 만나지만, 그들은 곧 섬이 바다 속으로 가라 앉고 있음을 알게 되는데…",/uHiszYVqR9zVs7IgVvMUabmx9Ag.jpg,Tz-aMDeKrkU
195,378064,목소리의 형태,"따분한 게 질색인 아이, 이시다 쇼야.  간디가 어떤 사람인지, 인류의 진화과정이라든지, 알게뭐람.  어느 날 쇼야의 따분함을 앗아갈 전학생이 나타났다. 니시미야 쇼코. 그 아이는 귀가 들리지 않는다고 한다.  쇼야의 짓궂은 장난에도 늘, 생글생글 웃고만 있다. 짜증난다.  그의 괴롭힘에 쇼코는 결국 전학을 갔고, 이시다 쇼야는 외톨이가 되었다.  6년 후, 더 이상 이렇게 살아봐야 의미가 없음을 느낀 쇼야는 마지막으로 쇼코를 찾아간다.  처음으로 전해진 두 사람의 목소리. 두 사람의 만남이 교실을, 학교를,  그리고 쇼야의 인생, 쇼코의 인생을 바꾸기 시작한다.",/emNuB1GNGjJqZiK9uVJNiUPbgsx.jpg,RCuFlaQlu4c
196,337167,50가지 그림자: 해방,"모든 과거를 잊고 서로에게 더 깊게 빠져든 ‘크리스찬 그레이’와 ‘아나스타샤’.  그레이의 독특한 취향으로 시작된 이 비밀스러운 관계는  더 큰 자극을 원하는 아나스타샤로 인해 역전되고,  마침내 그녀의 본능이 지배하는 마지막 절정의 순간을 맞이하게 되는데…",/kdN58uXDV5D0RWdMjdO9jtdFjxg.jpg,DB5aVXv-FU4
197,567189,톰 클랜시의 복수,임신한 아내가 살해되자 정의를 구현하고자 나선 한 엘리트 해군 특수 부대원이 그 과정에서 국제적 음모를 파헤치는 '톰 클랜시의 복수'. 작가 톰 클랜시가 창조한 잭 라이언 세계관에서 가장 유명한 액션 히어로 존 클라크의 폭발적 기원이 공개된다.,/6GCOpT8QcNzup09TAMmvvk22LTR.jpg,rlKaWSsdksg
198,630586,데드 캠프: 리부트,"젠(샬롯 베가)과 그녀의 다섯 절친들은 버지니아의 마을 애팔레치안에서 하이킹과 캠핑을 하고 있다. 남북전쟁 요새를 방문하러 가는 길에 경로를 벗어났다는 걸 알았을 때 그들은 ‘재단’이라 불리는 공동체 마을을 우연히 발견하게 된다. 그곳 사람들은 1800년대 이후, 미국 전역으로부터 자신들을 차단한 채 산 중턱에서 정착하여 살아가고 있었다. 결국 외딴곳에서 외부 영향으로부터 자신들을 보호하기 위해 그 어떤 일도 서슴없이 저지르는 마을 주민들과 엮이며 끔찍한 사건에 휘말리게 되는데...",/bHtwQS2Egb2T9GPRAT0aiZLWgdt.jpg,R8B3dr7gcGc
199,729720,더 라스트 머시너리,"오래전 프랑스를 떠나야 했던 첩보 요원. 그가 아들을 위해 자신을 등진 고국에 돌아온다. 테러 조직의 음모로 위험에 내몰린 아들. 아빠의 이름으로, 반드시 구하리라.",/sNfEiOU2QOACkdcUBKRzhFcIYTN.jpg,Zn5EdYGv8OE
200,254128,샌 안드레아스,"샌 안드레아스 단층이 마침내 끊어져 규모 9의 강진이 발생하자 구조헬기 조종사 드웨인 존슨은 사이가 멀어진 아내와 함께 외동딸을 구하기 위해 최악의 상황 속으로 뛰어든다. 세상이 무너지는 마지막 순간, 당신은 어디에서 누구와 함께 할 것인가!",/2ApoIxn6Bmtcj7BSXd8Cuyvd1QY.jpg,E3SOddsKnlU
201,420818,라이온 킹,"혈통을 이어받은 사자가 왕국을 다스리는 아프리카의 프라이드 랜드, 무파사의 아들 심바는 왕좌를 물려받기로 예정되어 있다. 하지만 탐욕스런 무파사의 동생 스카가 자신의 형제를 죽이고, 마치 그 원인이 심바에게 있는 것처럼 분위기를 조장해 그를 왕국에서 쫓아낸다. 아버지의 죽음에 대한 죄책감에 시달리던 심바는 의욕 충만한 친구들 품바와 티몬의 도움으로 희망을 되찾는다. 어느 날 우연히 옛 친구 날라를 만난 심바는 과거를 마주할 용기를 얻고, 진정한 자신의 모습을 찾아 위대하고도 험난한 도전을 떠나게 되는데...",/mOR24P4tXgcT3cjzPs7Ca0wog7X.jpg,SXMoaC3IJ3I
202,76338,토르: 다크 월드,"어벤져스의 뉴욕 사건 후, 다시 신들의 고향인 아스가르드 왕국으로 돌아간 토르와 로키. 지구를 위협한 로키는 지하 감옥에 갇히고, 토르는 아버지 오딘과 함께 우주의 질서를 재정립하기 위해 나선다. 1년 후, 지구에 혼자 남은 제인은 우연히 태초부터 존재해왔던 어둠의 종족 다크 엘프의 무기 에테르를 얻게 된다. 이 사실을 안 다크엘프의 리더 말레키스는 에테르를 되찾기 위해 제인과 아스가르드를 공격하고, 토르는 사랑하는 여인 제인과 아스가르드 왕국을 지키기 위해 로키에게 위험한 동맹을 제안하게 된다.",/aKnEwByCjXHpRoyOlSwYfmr9d5D.jpg,Og71gOvgn6M
203,681887,코스믹 씬,"인류가 우주를 식민지로 지배하고 있는 서기 2524년, 연맹의 장군 ‘제임스 포드’는 무리한 작전으로 행성 하나를 파괴하고 불명예 제대를 하게 된다. 인류를 지배하려는 외계 함대의 공격이 발생하자 ‘제임스 포드’ 장군은 정예 부대와 함께 이들을 제압하라는 부탁을 받게 된다. 하지만 외계 함대와 접촉하며 이미 조종된 인류는 연맹 군대를 공격하기 시작하는데...",/8rmTgYsB1S31GLy6QpRpBHODlr5.jpg,jdZp06-Kd8w
204,131631,헝거게임: 모킹제이,"캐피톨 VS 13구역 혁명군  게임은 끝났다! 물러설 수 없는 정면승부가 시작된다!  헝거게임이 끝나고 캣니스의 고향인 12구역이 캐피톨의 폭격으로 파괴되자 그녀는 절망감으로 괴로워한다. 12구역의 생존자들이 13구역에 있다는 것을 알게 된 캣니스는 반정부 세력의 중심이 된다. 어떤 공격도, 어떤 감시도 피할 수 있는 전설의 13구역을 다스리는 대통령 코인은 캣니스에게 혁명의 불꽃이자 반군의 상징인 모킹제이가 되어달라고 부탁하고, 모두의 희망이 된 캣니스는 이제 세상을 구할 반격을 시작한다.",/r5UG5tSXpHIFFcpx4rvi6ZnJroj.jpg,LZagBiVVo84
205,68721,아이언맨 3,"어벤저스의 일원으로 활약한 뉴욕 사건 이후, 트라우마로 인해 영웅으로서의 삶에 회의를 느끼는 토니 스타크. 그가 혼란을 겪는 사이 최악의 테러리스트 만다린을 내세운 익스트리미스 집단 AIM이 스타크 저택에 공격을 퍼붓는다. 이 공격으로 그에게 남은 건 망가진 수트 한 벌 뿐. 모든 것을 잃어버린 그는 다시 테러의 위험으로부터 세계와 사랑하는 여인을 지켜내야 하는 동시에 머릿속을 떠나지 않던 한가지 물음의 해답도 찾아야만 한다. 과연 그가 아이언맨인가? 수트가 아이언맨인가?",/pGMfidaVkjMVHXNIl7yippnipFT.jpg,UqBfpeO8Tqo
206,260513,인크레더블 2,"슈퍼맘 헬렌이 국민 히어로 일라스티걸로 활약하며 세상의 주목을 받자 바쁜 아내의 몫까지 집안일을 하기 위해 육아휴직을 낸 아빠 밥은 질풍노도 시기의 딸 바이올렛, 자기애가 넘치는 아들 대쉬, 어마무시한 능력을 시도때도 없이 방출하는 막내 잭잭까지 전담하며 전쟁같은 하루하루를 보낸다. 그러던 어느 날, 각자의 위치에서 바쁜 일상을 보내던 슈퍼파워 가족 앞에 새로운 악당이 나타났다. 다시 한번 세상을 구하기 위해 나선 가족은 ‘인크레더블’한 능력을 발휘할 수 있을까?",/qGmgOmeN8AQX5LwrAVaatwWffDs.jpg,zON6Mu9_PC0
207,49529,존 카터: 바숨 전쟁의 서막,"신비의 행성, 바숨 이 곳은 외계 종족간의 계속된 전쟁으로 서서히 파괴되고 있다. 시공간 이동을 통해 우연히 이곳에 오게 된 존 카터(테일러 키취)는 상상조차 할 수 없었던 특별한 능력을 갖게 되고, 그로 인해 행성의 운명이 걸린 거대한 전쟁에 뛰어들게 되는데…  2012년 3월, 전 우주를 뒤흔들 거대 전쟁의 서막이 오른다!",/1GrDKPMq4oVIxp6vohnQzlTRqW0.jpg,-eVoBQz319o
208,436931,포켓몬스터 극장판 - 너로 정했다!,"포켓몬 트레이너의 자격을 얻을 수 있는 10살이 되는 아침을 맞이한 지우는 오박사 연구소에서 파트너 포켓몬을 받을 예정이었지만, 늦잠을 자게 되고 마지막으로 남아 있는 낯을 가리고 사람을 잘 안 따르는 포켓몬 피카츄와 파트너가 된다. 첫만남부터 티격태격하며 우정을 쌓아가던 중 우연히 전설의 포켓몬을 목격하게 된 지우와 피카츄는 다시 한번 전설의 포켓몬을 찾아 떠나기로 약속하는데...",/eCZbgH40UWa239xlUFr2kxEUDzX.jpg,RkaPNL5-6lE
209,590706,주짓수,"혜성이 지구에 나타나고 제이크는 미지의 존재를 피해 달아나다 칼을 맞고 절벽 밑 바다로 떨어진다.  미얀마의 한 어부가 정신을 잃은 제이크를 발견하고 어부의 아내가 그를 치료한 뒤 미군 기지로 향한다.  그녀는 6년마다 혜성이 지구를 지날 때 죽음의 전사가 사원의 구멍을 통해 나타난다고 말하고 제이크를 넘겨준 뒤 미군 기지를 떠난다.  제이크의 몸에서 방사능이 검출되는 것을 수상히 여긴 육군 정보부 요원은 제이크를 심문하지만 제이크는 이전 일을 아무것도 기억하지 못한다.  얼마 후 쿠엥이 나타나 수많은 미군을 제압하고 제이크를 구해 기지에서 달아난다.  해리건, 마이라 등의 동료들과 재회한 제이크는 외계 존재 브랙스에 대한 이야기를 듣게 된다.  그리고 브랙스와 대결하지 않고 도망가면 마을 사람들이 대신 죽게 된다는 사실을 알게 된다.  제이크와 연인 마이라, 아버지 와일리 카르멘 9명의 전사는 치유능력과 첨단 무기로 무장한 브랙스와의 일전을 준비하는데...",/79bNNmoZh3I3fMepbFOeHUVtVlv.jpg,CCdqA9QXgKY
210,619778,말리그넌트,"폭력적인 남편의 죽음 이후, 연쇄 살인 현장이 보이기 시작했다. 그리고 어릴 적 상상 속의 친구 가브리엘이 진짜로 나타나는데...",/qfB6QNaCtmGDy9ujvBOUs7UaPx.jpg,7clSoGlNa0I
211,246655,엑스맨: 아포칼립스,"고대 이집트에서 신으로 숭배받았던 최초의 돌연변이 아포칼립스가 오랜 잠에서 깨어난다. 초능력을 흡수해가며 수천년을 살아온 아포칼립스는 스톰, 사일록, 아크엔젤 그리고 매그니토에게 자신의 힘을 나누어준 뒤, 그들과 함께 현재의 세상을 뒤엎고 새로운 세상을 건설하려 한다. 찰스 자비에와 미스틱은 아포칼립스의 지구 종말 계획을 알아채고, 진 그레이, 사이클롭스, 퀵 실버, 나이트크롤러 등 젊은 돌연변이들과 함께 아포칼립스에 대항한다.",/4MaTkqk4LKccDYKh7AjV220CVgW.jpg,bwiuWc0DNHc
212,119450,혹성탈출: 반격의 서막,"치명적인 바이러스 시미안 플루로 인류가 거의 멸망하고 소수만이 살아남은 시대. 유인원들은 도시를 떠나 숲에서 그들의 세상을 만들었다. 도시는 폐허가 되었고, 10년간 인간과 유인원은 서로 다른 공간에 머물며 마주치지 않고 살아왔기 때문에 유인원들은 인간이 멸종한 것이 아닐까 추정하고 있다. 그 평화가 깨진 것은 도시의 비상전력이 다 소진되면서부터. 전력 공급을 위해서는 유인원이 거주하는 숲에 있는 댐을 재가동해야 한다. 우연히 두 존재가 마주치게 되자, 유인원과 인간은 평화를 지킬 것인가 무력을 써서 주도권을 가져야 하나를 두고 내부 마찰을 겪는데...",/39kIGCP0mvRc9IZC1oJuIaJOaAb.jpg,W_t1XKjHd_Q
213,157336,인터스텔라,"세계 각국의 정부와 경제가 완전히 붕괴된 미래가 다가온다. 지난 20세기에 범한 잘못이 전 세계적인 식량 부족을 불러왔고, NASA도 해체되었다. 나사 소속 우주비행사였던 쿠퍼는 지구에 몰아친 식량난으로 옥수수나 키우며 살고 있다. 거센 황사가 몰아친 어느 날 알 수 없는 힘에 이끌려 딸과 함께 도착한 곳은 인류가 이주할 행성을 찾는 나사의 비밀본부. 이 때 시공간에 불가사의한 틈이 열리고, 이 곳을 탐험해 인류를 구해야 하는 임무를 위해 쿠퍼는 만류하는 딸을 뒤로한 채 우주선에 탑승하는데...",/zDNAeWU0PxKolEX1D8Vn1qWhGjH.jpg,LEEtpP6dkIY
214,899082,해리 포터 20주년: 리턴 투 호그와트,"‘해리포터와 마법사의 돌' 20주년 기념 스페셜. 다니엘 래드클리프, 루퍼트 그린트, 엠마 왓슨을 포함한 캐스트, 감독들이 재결합해 해리포터 프랜차이즈의 첫 영화를 회고하고, 축하하는 시간을 가진다.  '해리포터 20주년 기념: 리턴 투 호그와트'는 심층 인터뷰와 출연진 토크를 통해 역대 가장 사랑 받았던, 마법 같은 프랜차이즈의 세계로 팬들을 초대한다.  헬레나 본햄 카터, 로비 콜트레인, 랄프 파인즈, 제이슨 아이삭스, 게리 올드만, 톰 펠튼, 제임스 펠프스, 올리버 펠프스, 마크 윌리엄스, 보니 라이트, 알프레드 에녹, 매튜 루이스, 이반나 린치를 포함한 다양한 캐스트들이 함께 한다.",/jntLBq0MLR3hrwKaTQswxACRPMs.jpg,yRxmrF2E9x4
215,168259,분노의 질주: 더 세븐,"도미닉(반 디젤)과 멤버들은 범죄조직 소탕 후 모든 전과를 사면 받고 평범한 일상으로 돌아간다. 하지만 평화도 잠시, 전작에서 처리한 범죄조직의 리더 오웬 쇼의 형 데카드 쇼(제이슨 스타뎀)가 동생의 복수를 위해 멤버들을 차례로 공격한다. 특수부대 출신 용병 데카드 쇼의 난입으로 한(성 강)이 갑작스레 사망하게 되고, 도미닉의 집은 순식간에 폭파당한다. 이에 맞서는 정부요원 페티(커트 러셀)는 도미닉을 돕는 조건으로 납치당한 해커 램지(나탈리 엠마누엘)의 구출을 의뢰하고, 도미닉은 멤버들을 다시 모아 숨막히는 반격을 시작한다.",/cuQdgDYANbKA46e4va2fz6fODkc.jpg,5dkItLtiYR0
216,34851,프레데터스,"더욱 강력해지고 포악해진 놈들이 온다! 알 수 없는 외계 행성에 영문도 모른 채 끌려온 7명의 킬러들. 전직 의사 한 명을 제외하곤 용병, 야쿠자, 사형수, 암살단원 등 지구에서 극악무도한 범죄를 저지른 자들이다. 자신들이 어디에 와 있는 지 알아채기도 전에 그들은 강력한 힘을 가진 정체불명의 생명체에게 쫓기기 시작한다. 그 정체불명의 생명체는 우주 최강의 포식자, 프레데터들이다. 더욱 강력하게 진화한 놈들은 프레데터 하운드독과 팔콘을 부리며 보다 지능적으로 무자비한 인간 사냥에 나선다. 점차 밝혀지는 프레데터들의 충격적인 비밀 앞에 지구에서 가장 위험한 존재였던 킬러들은 힘을 모을 수 밖에 없다. 살아남기 위해서.",/6OPKWPCXf7veLpK9l4VMtxFVVc2.jpg,7MpsdpFtlzo
217,82690,주먹왕 랄프,"8비트 게임 ‘다고쳐 펠릭스’에서 건물을 부수는 악당 주먹왕 랄프. 30년째 매일같이 건물을 부수며 직업에 충실해왔지만, 악당이라는 이유로 누구도 그를 좋아하지 않는다. 모두에게 인정 받는 영웅이 되고 싶은 마음에 급기야 자기 게임을 이탈하여 다른 게임으로 들어가는 랄프! 슈팅게임 ‘히어로즈 듀티’를 거쳐 레이싱 게임 ‘슈가 러시’에 불시착하는 랄프는 과연 게임 세계의 새로운 영웅이 될 수 있을 것인가! 그리고 랄프가 떠난 후 고장 딱지가 붙은 ‘다고쳐 펠릭스’ 게임은 오락실에서 퇴출될 위기를 넘길 수 있을까?",/A6jGfyW7yzTpXkRJovUhe2IanKu.jpg,SyeNC2h2C10
218,14160,업,"평생 모험을 꿈꿔 왔던 칼 할아버지는 재개발 공사 현장의 인부를 실수로 다치게 하고 집을 빼앗길 위기에 처한다. 그 동안 미뤄 왔던, 먼저 세상을 떠난 아내와의 약속을 지키기 위해 그는 수천 개의 풍선을 매달아 집을 통째로 남아메리카로 날려 버린다. 하지만 이 위대한 모험에 초대 받지 않은 불청객이 있었으니, 바로 황야의 어린이 탐험가 러셀. 우여곡절 끝에 도착한 남미에서 칼은 어린 시절의 우상이었던 위대한 모험가 찰스 먼츠를 만나게 되는데... 그들은 과연 남미의 잃어버린 세계에서 사라져 버린 꿈과 희망, 행복을 다시 찾을 수 있을까?",/lL2WzkjLZP0RkPgUhybBjb9x9SL.jpg,551YG0kBQks
219,475557,조커,"홀어머니와 사는 아서 플렉은 코미디언을 꿈꾸지만 그의 삶은 좌절과 절망으로 가득 차 있다. 광대 아르바이트는 그에게 모욕을 가져다주기 일쑤고, 긴장하면 웃음을 통제할 수 없는 신경병 증세는 그를 더욱 고립시킨다. 정부 예산 긴축으로 인해 정신과 약물을 지원하던 공공의료 서비스마저 없어져 버린 어느 날, 아서는 지하철에서 시비를 걸어온 증권사 직원들에게 얻어맞던 와중에 동료가 건네준 권총으로 그들을 쏴 버리고 만다. 군중들은 지배계급에 대한 저항의 아이콘이 된 그를 추종하기 시작하며 광대 마스크로 얼굴을 가리고 거리로 쏟아져 나오기 시작하는데...",/wrCwH6WOvXQvVuqcKNUrLDCDxdw.jpg,NYFhUFQGX6g
220,527641,파이브 피트,"같은 병을 가진 사람끼리 6피트 이상 접근해서도, 접촉도 해선 안되는 CF(낭포성 섬유증)를 가진 ‘스텔라’와 ‘윌’. 첫눈에 반한 두 사람은 서로를 위해 안전거리를 유지하려고 하지만 그럴수록 더욱 빠져든다. 손을 잡을 수도 키스를 할 수도 없는 그들은 병 때문에 지켜야 했던 6피트에서 1피트 더 가까워지는 걸 선택하고 처음으로 용기를 내 병원 밖 데이트를 결심한다. 그러나 갑자기 숨을 쉬지 못하는 ‘스텔라’. ‘윌’은 그녀를 살리기 위해 안전거리를 어기게 되는데…",/8bXlrAzTJKwedmUDKBhiaU7OkqW.jpg,hV8yIRBe8tI
221,559,스파이더맨 3,"대중의 사랑을 듬뿍 받으며 진정한 영웅으로 거듭난 스파이더맨, 피터 파커는 어느 날, 외계에서 온 수수께끼의 유기체인 심비오트에 감염되고 스파이더맨은 오리지날 스파이더맨에서 블랙 슈트 스파이더맨으로 변화한다. 한층 업그레이드 되고 강력해진 파워를 얻게 된 스파이더맨은 자신의 힘에 도취되어 마음껏 세상을 즐긴다. 그러나 아버지의 복수를 위해 뉴 고블린이 된 해리와 물리 실험에 노출되어 능력을 얻게 된 피터의 삼촌을 죽인 진범 샌드맨은 호시탐탐 스파이더맨을 노리는데...",/tbPLMa0cZ4bUnyCYD0loAJeoz2H.jpg,QzSkaWmjIpY
222,343611,잭 리처: 네버 고 백,군사 스파이 혐의로 자신의 후임인 수잔 터너 소령이 체포되자  잭 리처만이 그녀의 무죄를 확신하고 탈출을 돕는다. 사건의 진실을 파헤치던 중 관련된 사람들이 잇따라 살해 당하기 시작하고  잭 리처는 이 모든 사건의 배후에 누군가가 존재한다는 것을 알게 되는데...,/ma7URAUCaue8WXnjpc7qPrJgAuR.jpg,yBSmjbfCaHc
223,207703,킹스맨: 시크릿 에이전트,"높은 IQ, 주니어 체조대회 2년 연속 우승! 그러나 학교 중퇴, 해병대 중도 하차. 동네 패싸움에 직장은 가져본 적도 없이 별볼일 없는 루저로 낙인 찍혔던 ‘그’가‘젠틀맨 스파이’로 전격 스카우트 됐다! 전설적 베테랑 요원 해리 하트(콜린 퍼스)는 경찰서에 구치된 에그시(태런 애거튼)를 구제한다. 탁월한 잠재력을 알아본 그는 에그시를 전설적 국제 비밀정보기구 ‘킹스맨’ 면접에 참여시킨다. 아버지 또한 ‘킹스맨’의 촉망 받는 요원이었으나 해리 하트를 살리기 위해 죽었다는 사실을 알게 된 에그시. 목숨을 앗아갈 만큼 위험천만한 훈련을 통과해야 하는 킹스맨 후보들. 최종 멤버 발탁을 눈 앞에 둔 에그시는 최고의 악당 발렌타인(사무엘 L. 잭슨)을 마주하게 되는데…",/9trg6xOTadyHOkl5rN5nlLjx4L8.jpg,SW6EKneLyCI
224,27205,인셉션,"타인의 꿈과 접속해 생각을 빼낼 수 있는 근미래, 돔 코브는 꿈의 보안 프로그래머이자 동시에 침입자다. 그는 일본인 사업가 사이토의 제안에 따라 거대 합병 기업의 총수가 될 피셔의 꿈을 설계하여 기업 합병을 막으려 든다. 그 일을 성사시키면 코브는 사이토의 도움으로 아내의 살해범으로 몰린 자신의 누명을 뒤로 하고 사랑스런 자녀들이 있는 집으로 돌아갈 수 있다. 마침내 코브 일행은 꿈 안의 꿈 안의 또 꿈이라는 경로를 거치며 피셔의 꿈과 무의식 깊숙한 곳을 설계하고 침투한다.",/jSm8mzp7sucgL8NwINIoAmx4dS5.jpg,hx1fqhNoH8A
225,8966,트와일라잇,"17세의 평범한 고등학생 소녀 ‘벨라’는 집안 사정으로 워싱턴 주 포크스에 있는 아빠의 집으로 이사를 온다. 전학 첫날, ‘벨라’는 냉담하지만 자신을 무장 해제시킬 정도로 잘생긴 ‘에드워드’와 마주치고, 전율과 두려움 넘치는 인생의 전환을 맞이한다. ‘에드워드’와 돌이킬 수 없는 사랑에 빠져든 ‘벨라’. 하지만 ‘에드워드’와 그의 가족이 뱀파이어 일족이라는 사실을 알게 되고, 예기치 못한 운명에 빠져든다.",/2yGW99KWCPpCBbi4aPIZyWb5OzE.jpg,e8lynTVeKYU
226,412656,카오스 워킹,"모든 생각이 실시간으로 노출되는 노이즈에 감염된 세상 뉴 월드. 토드는 이곳에 불시착한 의문의 유입자 바이올라와 마주하게 된다. 혼돈의 세상 속 숨겨진 비밀에 의문을 품은 두 사람은 뉴 월드를 탈출할 계획을 세우고, 뉴 월드의 통치자 데이비드는 위험을 직감하고 이들을 추격하기 위해 모든 수단을 동원하는데…",/jlmuSzTXOppShgYZbeetWTFTi6P.jpg,pPv5ShSdUNE
