,id,title,overview,poster_path,video_key
0,752623,로스트 시티,전설의 트레저를 차지하기 위해 재벌 페어팩스(다니엘 래드클리프)는  유일한 단서를 알고 있는 베스트셀러 작가 로레타(산드라 블록)를 납치하게 된다.  어쩔 수 없는 비지니스 관계로 사라진 그녀를 찾아야만 하는 책 커버모델 앨런(채닝 테이텀)은  의문의 파트너(브래드 피트)와 함께 위험한 섬에서 그녀를 구하고 무사히 탈출해야만 하는데…  적과 자연의 위험이 도사리는 일촉즉발 화산섬.,/8kZapNBZYGJu7AUbJVBDMmQgO1D.jpg,0SBaYuj7Sl0
1,526896,모비우스,"희귀혈액병을 앓고 있는 생화학자 모비우스는 동료인 마르틴과 함께 치료제 개발에 몰두한다. 흡혈 박쥐를 연구하던 중 마침내 치료제 개발에 성공한 모비우스는 새 생명과 강력한 힘을 얻게 되지만, 동시에 흡혈을 하지 않고는 생명을 유지할 수 없게 된다. 그러던 중 모비우스와 같은 병을 앓고 있던 그의 친구 마일로도 모비우스와 같은 힘을 얻게 되는데…",/8uiV88A5eB7PjMTtY6lQBUZ0Cpl.jpg,9Z79vlm3zW8
2,675353,수퍼 소닉 2,강력한 파워의 ‘너클즈’와 함께 돌아온 천재 과학자 ‘닥터 로보트닉’에 맞서 지구를 구하기 위해 ‘소닉’과 새로운 파트너 ‘테일즈’가 전 세계를 누비는 스피드 액션 블록버스터.,/8dzKn3RtPWUJRG9ymSpi423eMNV.jpg,7wl6UrO1UjI
3,639933,노스맨,"10세기 아이슬란드, 숙부를 향한 '암레트' 왕자의 복수극을 그린 영화",/bfeM8NGWm1riLvvVxHDPLtWCRkF.jpg,tvnpP8mN8us
4,335787,언차티드,"평범한 삶을 살던 네이선은 인생을 바꿀 뜻밖의 제안을 받는다. 그의 미션은 크루와 함께 사라진 형과 500년 전 잃어버린 천문학적인 가치를 지닌 트레져를 찾아내는 것. 그러나 몬카다의 위협 속, 누구보다 빠르게 미지의 세계에 닿기 위해 결단을 내려야만 하는데…",/2R8smeSDkPx6TKIRveKPXi0JVI6.jpg,VwNU4BKxpDc
5,414906,더 배트맨,"지난 2년 간 고담시의 어둠 속에서 범법자들을 응징하며 배트맨으로 살아온 브루스 웨인. 알프레드와 제임스 고든 경위의 도움 아래 그는 도시의 부패한 공직자들과 고위 관료들 사이에서 복수의 화신으로 활약한다. 고담의 시장 선거를 앞두고 고담의 엘리트 집단을 목표로 잔악한 연쇄살인을 저지르는 수수께끼 킬러 리들러가 나타나자, 최고의 탐정 브루스 웨인이 수사에 나서고 남겨진 단서를 풀어가며 캣우먼, 펭귄, 카마인 팔코네, 리들러를 차례대로 만난다. 사이코 범인의 미스터리를 수사하면서 그 모든 증거가 자신을 향한 의도적인 메시지였음을 깨닫고,  리들러에게 농락 당한 배트맨은 광기에 사로잡힌다. 범인의 무자비한 계획을 막고 오랫동안 고담시를 썩게 만든 권력 부패의 고리를 끊어야 하지만, 부모님의 죽음에 얽힌 진실이 밝혀지자 복수와 정의 사이에서 갈등하는데...",/bCz71ysciwNL2xddSm25ufrgZ7V.jpg,1fAA87ds32o
6,453395,닥터 스트레인지: 대혼돈의 멀티버스,"끝없이 균열되는 차원과 뒤엉킨 시공간의 멀티버스가 열리며 오랜 동료들, 그리고 차원을 넘어 들어온 새로운 존재들을 맞닥뜨리게 된 닥터 스트레인지. 대혼돈 속, 그는 예상치 못한 극한의 적과 맞서 싸워야만 하는데….",/vL5ktZauR0fZMDOHKjakb1idhuU.jpg,Xojsvie3UpM
7,634649,스파이더맨: 노 웨이 홈,‘미스테리오’의 계략으로 세상에 정체가 탄로난 스파이더맨 ‘피터 파커’는 하루 아침에 평범한 일상을 잃게 된다. 문제를 해결하기 위해 ‘닥터 스트레인지’를 찾아가 도움을 청하지만 뜻하지 않게 멀티버스가 열리면서 각기 다른 차원의 불청객들이 나타난다. ‘닥터 옥토퍼스’를 비롯해 스파이더맨에게 깊은 원한을 가진 숙적들의 강력한 공격에 ‘피터 파커’는 사상 최악의 위기를 맞게 되는데…,/voddFVdjUoAtfoZZp2RUmuZILDI.jpg,bG3FmxSTwKw
8,629542,배드 가이즈,"작전 설계부터 금고 해제, 해킹, 액션, 위장까지 완벽한 팀플레이를 펼치는 자타공인 최고의 나쁜 녀석들이 한순간의 실수로 체포된다.  하지만 그들도 착해질 수 있다는 ‘마멀레이드 박사’의 주장으로 나쁜 녀석들은 바른 생활 갓생 프로젝트에 투입되고, 이들은 다시 한번 자유의 몸을 위해 태어나 처음으로 바른 생활에 도전하게 되는데…  나쁜 녀석들의 사상 초유 바른 생활 갓생 프로젝트가 시작된다!",/x6KSvale7iuxLhsrEfhYNoICyfK.jpg,57YJYXmA7xE
9,628900,더 컨트랙터,"특수부대 중사 출신 ‘제임스 하퍼’는 전역을 명 받고 법의 테두리 밖에서 국가에 충성하는 극비 조직에 합류한다. 그에게 주어진 첫번째 미션은, 전세계를 혼란에 빠뜨릴 바이러스 테러를 막는 것. 그러나, 미션 수행 도중 거대한 음모에 휘말리게 되고 충격과 위기를 겪게 되는데… 더 이상 물러설 곳은 없다.  모든 것을 건, 새로운 미션이 시작된다!",/fZid9LbFTZV7NjM0qMwL1mPjhqu.jpg,RTt7K2zlhn0
10,508947,메이의 새빨간 비밀,"엄마의 착한 딸, 아니면 미운 13살? 성적도 우수하고 친구들과 사이도 좋은 데다 부모와도 친밀한 관계를 유지하고 있는, 똑 부러지면서도 엉뚱한 매력의 소유자 메이는 요즘 질풍노도의 시기를 겪느라 고민이 많다. 이 나이에 엄마의 과잉보호를 받자니 스트레스가 이만저만이 아닌 데다, 관심사, 인간관계, 신체 등 그녀의 모든 것이 변하고 있기 때문. 그런데 이 와중에 흥분하면 거대한 레서판다로 변신하는 비밀까지 떠안게 되다니! 아침도 먹어야 하고 학교도 가야 하는데, 이 엄청난 비밀을 어떻게 숨겨야 할까?",/hsOhOcX7qDy7bPwbrt1OoITngrf.jpg,kyn-dYNqTPI
11,406759,문폴,"궤도를 이탈한 달이 지구를 향해 떨어지기 시작하면서 지구의 중력과 모든 물리적인 법칙이 붕괴된다. 거대한 해일과 지진, 화산폭발, 쓰나미와 이상기후까지 상상조차 불가능했던 모든 재난으로 전 세계는 공포와 혼란에 빠진다. 달과 충돌까지 남은 시간은 단 30일. NASA 연구원 파울러, 전직 우주 비행사 브라이언, 그리고 우주 덕후 KC는 달을 막을 방법을 찾기 위해 마지막 우주선에 오른다.",/2xmJCxrt5t2dFhvwvmxZ5Cy577j.jpg,lV8MuZC_-Fo
12,763285,앰뷸런스,"인생 역전을 위해 완벽한 범죄를 설계한 형 대니와 아내의 수술비를 마련해야만 하는 동생 윌, 함께 자랐지만 서로 다른 인생을 살아온 두 형제는 각기 다른 목적을 위해 인생을 바꿀 위험한 계획에 뛰어들게 된다. 그러나 한 순간의 잘못된 선택으로 인해 모든 계획이 틀어지게 된 두 형제는 구급대원 캠과 부상당한 경찰이 탑승한 앰뷸런스를 탈취해 LA 역사상 가장 위험한 질주를 하게 되는데....",/t28iy60uX4sRZhKo2MMxCKyQw1a.jpg,7z3u8cvneHE
13,284052,닥터 스트레인지,"오만함과 실력 모두 최고인 신경외과 의사 닥터 스티븐 스트레인지는 운전 중에 핸드폰을 한 대가로 두 손의 신경이 끊어지는 심각한 부상을 입고 큰 상심에 빠진다. 게다가 모난 말들로 사랑하는 여인 크리스틴 팔머마저 그의 곁을 떠나게 만든다. 그는 치료를 위해 히말라야의 영적 지도자, 에인션트 원을 만나 마지막 희망을 걸고 수련을 시작한다. 스트레인지는 빠르게 마법을 터득해 나가는 동시에 세계의 작동원리와 우주를 정복하려는 도르마무 일당의 계략을 알게 된다.",/xA7ic72L0mejJX1SYMU38F7wwiF.jpg,xNcJ0lIDPkE
14,568124,엔칸토: 마법의 세계,"콜롬비아의 깊은 산 속, 놀라운 마법과 활기찬 매력이 넘치는 세계 엔칸토. 이곳을 만든 장본인은 마드리갈 가문의 기둥인 알마 할머니(마리아 세실리아 보테로)다. 그녀는 젊었을 때 세 쌍둥이를 데리고 이곳으로 오던 중에 위기를 맞았다. 그때 그녀가 들고 있던 촛불에 기적이 일어났고 그이후로 마법의 능력이 손주 세대까지 대물림된다. 3대에 걸친 이대가족은 음식으로 병을 고치는 능력, 꽃을 피우는 능력, 날씨를 조종 하는 능력 등 저마다 독특한 능력을 지니게 됐다. 하지만 가족 중 유일하게 미라벨(스테퍼니 비어트리즈)만 아무런 능력이 없다. 어느 날 엔칸토가 지닌 마법의 힘이 위험에 처하고 가족들은 점차 자신의 능력을 잃어가기 시작한다. 이를 감지한 미라벨은 유일하게 평범한 자신이 특별한 이 가족의 마지막 희망일지 모른다고 생각하는데...",/b8gz7UKMwMz39mz6EH5Jjicjdth.jpg,1zA_fjxLzqA
15,606402,야차,비밀공작팀과 팀의 악명 높은 리더를 감찰하기 위해 위험천만한 도시로 날아간 검사. 정직하게 살아온 그가 스파이들 사이의 치명적인 전쟁 속으로 뛰어든다.,/nOYyuJ2mNo6RWsFsTwApEyG3F4J.jpg,igxszthKCv4
16,774825,아이스 에이지: 벅의 대모험,"모두의 사랑을 받는 선사 시대 포유류들의 유쾌한 모험이 계속된다. 누나 엘리와 따로 떨어진 스릴을 찾는 주머니쥐 형제 크래시와 에디는 그들만의 공간을 찾아 길을 나서지만, 곧 거대한 지하 동굴에 갇히게 되고, 모험을 사랑하는 공룡 사냥꾼 애꾸눈 족제비 벅 와일드의 도움으로 위험에서 벗어난 둘은 벅과 함께 잃어버린 세계에 서식하는 난폭한 공룡들과 마주한다.",/iKFpQoNiS2q9AZ3dEPv1zfkmHvs.jpg,k1WYZgOstmU
17,696806,애덤 프로젝트,시간 여행 중 2022년에 불시착한 전투기 파일럿 애덤 리드. 그가 12살 시절의 자기 자신과 한 팀이 되어 미래를 구하는 임무에 나선다.,/wFjboE0aFZNbVOF05fzrka9Fqyx.jpg,CCFGfbA3omw
18,338953,신비한 동물들과 덤블도어의 비밀,"1930년대, 제2차 세계대전에 마법사들이 개입하게 되면서 강력한 어둠의 마법사 그린델왈드의 힘이 급속도로 커진다. 덤블도어는 뉴트 스캐맨더에게 위대한 마법사 가문 후손, 마법학교의 유능한 교사, 머글 등으로 이루어진 팀에게 임무를 맡긴다. 이에 뉴트와 친구들은 머글과의 전쟁을 선포한 그린델왈드와 추종자들, 그의 위험한 신비한 동물들에 맞서 세상을 구할 거대한 전쟁에 나선다. 한편 전쟁의 위기가 최고조로 달한 상황 속에서 덤블도어는 더 이상 방관자로 머물 수 없는 순간을 맞이하고, 서서히 숨겨진 비밀이 드러나는데...",/uvQbXjMgC5weQepx4jLJJ60H3N0.jpg,N4Ds-d2PQ-I
19,580489,베놈 2: 렛 데어 비 카니지,"‘베놈'과 완벽한 파트너가 된 ‘에디 브록' 앞에 ‘클리터스 캐서디'가 ‘카니지'로 등장, 앞으로 닥칠 대혼돈의 세상을 예고한다. 대혼돈의 시대가 시작되고, 악을 악으로 처단할 것인가?",/1Lh9LER4xRQ3INFFi2dfS2hpRwv.jpg,BvNv6JDw8PQ
20,438695,씽2게더,"대국민 오디션 이후 각자의 자리에서 꿈을 이루고 있는 버스터 문(매튜 맥커너히)과 크루들에게 레드 쇼어 시티에서 전 세계가 주목하는 사상 최고의 쇼가 펼쳐진다는 소식이 들려오고 버스터 문과 크루들은 도전에 나선다. 그러나 최고의 스테이지에 서기 위한 경쟁은 이전과는 비교도 할 수 없을 만큼 치열하고, 버스터 문은 완벽한 라이브를 위해 종적을 감춘 레전드 뮤지션 클레이(보노)를 캐스팅하겠다는 파격 선언을 하는데!",/xe8dVB2QiCxLWFV77V4dpZcOvYB.jpg,GSLrzxJBI80
21,823625,블랙라이트,언더커버 요원들을 관리하는 FBI 비공식 요원 ‘트래비스’(리암 니슨)는  한 요원의 사망으로 조직의 충격적인 비밀과 마주한다!  추악한 악행을 멈출 수 있는 사람은 오직 하나!  모든 걸 끝내기 위한 그의 마지막 미션이 시작된다!,/4S09SjrU5vL6zK0FbDY3YnxtmR3.jpg,AqVN8Sef13s
22,635302,귀멸의 칼날 극장판 무한열차편,"혈귀로 변해버린 여동생 네즈코를 인간으로 되돌릴 단서를 찾아 비밀조직 귀살대에 들어간 탄지로. 젠이츠, 이노스케와 새로운 임무 수행을 위해 무한열차에 탑승 후 귀살대 최강 검사 염주 렌고쿠와 합류한다. 달리는 무한열차에서 승객들이 하나 둘 흔적 없이 사라지자 숨어있는 식인 혈귀의 존재를 직감하는 렌고쿠. 귀살대 탄지로 일행과 최강 검사 염주 렌고쿠는 어둠 속을 달리는 무한열차에서 모두의 목숨을 구하기 위해 예측불가능한 능력을 가진 혈귀와 목숨을 건 혈전을 시작하는데...",/m2FNRngyJMyxLatBMJR8pbeG2v.jpg,VviIeYKkGpM
23,524434,이터널스,"이터널스는 7천년 전 우주선 도모를 타고 지구에 온 순간부터 지구를 사랑한 히어로들이다. 이들의 임무는 기괴한 크리처 데비안츠에게서 인간을 지키는 것. 임무를 부여한 이는 그들을 탄생시킨 천상의 존재 셀레스티얼이다. 이터널스는 시간의 흐름을 느낄 수 없기에, 공간을 기준 삼아 연대기를 구성하는 뱀파이어처럼 세계 곳곳에 흩어져 자신만의 삶을 살아가고 있다. 물질을 변화시키는 세르시는 런던에서 박물관 학자가 됐고, 우주의 기운을 총처럼 쏘는 킹고는 발리우드 배우로 살며, 타인을 조종하는 드루이그는 아마존에 소국을 만들었다. 괴력의 소유자 길가메시는 호주 사막에서 정신 건강이 위험해진 테나를 돌보며 살고 있다. 세르시는 데비안츠의 공세가 심해지자 오랜 연인 이카리스, 소녀처럼 보이는 불멸의 존재 스프라이트와 함께 이터널스를 불러모으기 시작한다.",/aNtAP8ZzUMdnCPoqYgVOcgI0Eh4.jpg,omidgvTcTcE
24,566525,샹치와 텐 링즈의 전설,초인적인 능력을 가진 텐 링즈의 힘으로 수세기 동안 어둠의 세상을 지배해 온 웬우. 샹치는 아버지 웬우 밑에서 암살자로 훈련을 받았지만 이를 거부하고 평범함 삶을 선택한다. 샌프란시스코로 떠나와 자신의 진짜 이름을 숨긴 채 션이란 가명으로 살아가는 샹치. 웬우가 수장으로 있는 조직 텐 링즈의 일원인 레이저 피스트가 찾아와 샹치의 펜던트를 훔쳐가자 샹치는 친구 케이티와 함께 연이 끊겼던 동생 샤링을 염려하며 그녀가 숨어 지내는 마카오로 찾아간다. 텐 링즈의 마법 같은 힘을 통해 수천년 동안 지구의 역사를 혼란에 빠뜨렸던 웬우는 자신의 아들딸을 다시 불러들여 새로운 계략을 꾸민다.,/14L4NGrqO4r7gJtVRiSRP5rNsL5.jpg,QXfVIrzYqzE
25,833425,출구는 없다,어머니가 위독하다는 소식을 듣고 가족에게 가던 다비는 눈보라 때문에 낯선 이들과 고속도로 휴게소로 대피한다. 주차장의 밴에서 납치된 소녀를 본 다비는 납치범을 찾아 사투를 벌인다.,/aZmNC8uP82HQpykPDQvJhm7Rxu8.jpg,AirboSJZOn0
26,459151,보스 베이비 2,베이비 주식회사의 레전드 보스 베이비에서 인생 만렙 CEO가 된 `테드`. 베이비인 줄 알았던 조카 `티나`가 알고 보니 베이비 주식회사 소속이라니! 뉴 보스 베이비 `티나`의 지시로 `테드`는 형과 함께 다시 베이비로 돌아가야만 하는데…,/zGaeo3fNXCcnttUQMgZr1FW0t4V.jpg,tZYJIPnC2Qg
27,760868,블랙 크랩,"종말이 찾아온 세상, 여섯 명의 군인에게 극비 임무가 주어진다. 목표는 군도 사이의 얼어붙은 바다를 건너 불가사의한 물건을 운반하는 것.",/3WBcQlVTeoLelZghABwmhe4b9C5.jpg,mOefH7CED8I
28,778106,여름밤을 달려 봐,"대학 입학을 앞둔 여름, 미스터리한 소년 일라이를 만난 모범생 오든. 밤마다 일라이와 함께 이곳저곳을 누비며 그동안 경험하지 못했던 자유분방한 10대의 삶을 맛본다.",/d5spmLeGR9kxBRQ6qxCFad1ljvT.jpg,eZ-_VK-oNOw
29,476669,킹스맨: 퍼스트 에이전트,"역사상 최악의 폭군들과 범죄자들이 모여 수백만 명을 학살하기 위한  전쟁을 모의하는 급박한 상황 속, 그들을 막아야 하는 한 사람이 있다. 비밀에 쌓여 있던 독립 정보 기관 ‘킹스맨’의 탄생을 확인하라!",/vOai6V9hsIqZu15zDKydPmzu4EN.jpg,Inl1vmPWV_Q
30,460458,레지던트 이블: 라쿤시티,"거대 제약회사 '엄브렐라'가 철수한 후 폐허가 된 '라쿤시티'. 어릴 적 끔찍한 사건을 겪고 고향을 떠났던 클레어가 돌아온 그날 밤, 라쿤시티는 좀비 바이러스에 감염되어 순식간에 지옥으로 돌변한다. 남은 시간은 7시간, 죽음의 도시를 탈출하라!",/3d1ij4MEw3h2AZv62C49ysDfuG1.jpg,gr7GcWokRUQ
31,19995,아바타,"가까운 미래, 지구는 에너지 고갈 문제를 해결하기 위해 머나먼 행성 판도라에서 대체 자원을 채굴하기 시작한다. 하지만 판도라의 독성을 지닌 대기로 인해 자원 획득에 어려움을 겪게 된 인류는 판도라의 토착민 나비의 외형에 인간의 의식을 주입, 원격 조종이 가능한 새로운 생명체를 탄생시키는 프로그램을 개발한다. 한편 하반신이 마비된 전직 해병대원 제이크 설리는 아바타 프로그램에 참가할 것을 제안받는다. 그 곳에서 자신의 아바타를 통해 자유롭게 걸을 수 있게 된 제이크는 자원 채굴을 막으려는 나비의 무리에 침투하라는 임무를 부여받는데...",/zygmx5abXeDpr3fWYX4jlXFZ1wh.jpg,zS0BA8FnnKc
32,585245,클리포드 더 빅 레드 독,"뉴욕의 아파트로 이사 온 12살 소녀 에밀리. 새로운 학교에 고군분투하는 에밀리를 바쁜 엄마는 출장을 가면서 철없는 삼촌 케이시에게 맡기고 떠난다.  마법 동물 구조 센터를 지나던 에밀리는 운명처럼 작고 빨간 강아지를 만나게 되고, 우여곡절 끝에 함께하게 된다. 하지만 기쁨도 잠시, 작고 빨간 강아지 클리포드는 하루 아침에 3M가 넘게 커져버려 순식간에 뉴욕의 유명인사가 되어버린다. 엄마가 오기 전 클리포드를 되돌리려는 에밀리와 클리포드를 유전학 사업에 이용하려는 기업까지 뒤쫓으며 클리포드는 위험에 빠지고 마는데..!",/mJwwkMKeR5XgHwexw9SJa6CiZY2.jpg,n9_v7L7t51c
33,425909,고스트 버스터즈 라이즈,"할아버지의 갑작스런 죽음으로 이사하게 된 트레버, 피비 남매는 남겨진 집에서 의문의 현상과 수상한 물건들을 마주한다. 집뿐 아니라 마을 전체가 설명할 수 없는 미스터리한 현상이 연이어 발생하는 가운데, 교사로 위장 취업한 지질학자 그루버슨과 이들은 세상의 종말과 관련된 비밀을 쫓기 시작하는데…",/in2aUEUaFxBJZniu9qZh5P9s1Tw.jpg,jOmgKXY8okk
34,646385,스크림,"잔혹한 살인 사건으로 우즈보로 마을이 충격에 휩싸인 지 25년이 지난 후,  고스트 페이스를 한 새로운 살인마가 다시 십대들을 노리면서 마을의 어두운 비밀이 다시 수면 위로 떠오르는데…",/j2lndg3r6pshxFJyDJZnn50EklS.jpg,GYp4dcRoTJw
35,1865,캐리비안의 해적: 낯선 조류,"부두교의 주술을 부리던  검은 수염은 다리가 한쪽인 남자에게 죽게 된다는 예언을 듣게 된다. 자신의 수명을 늘리기 위해 검은 수염은 젊음의 샘을 찾으러 떠나고, 바르보사 또한 검은수염에게 복수를 하기 위해 그를 뒤쫒는다. 한편 영국에서 블랙펄의 선장이 선원을 모집한다는 소문을 듣게 된 잭 스패로우는 자신을 사칭하는 사기꾼을 잡으려다 영국 왕실에 체포되고, 영국의 국왕은 잭 스패로우에게 젊음의 샘으로 가는 길을 안내하라고 명령하고, 이에 필요한 선장과 배, 선원을 모두 내 주겠다고 하는데...",/osJVVjkHmoO5WoJfbBsImYrKWIb.jpg,xOh59O9rrMg
36,632727,텍사스 전기톱 학살 2022,텍사스의 한 유령 도시. 이곳에 생기를 불어넣겠다는 꿈을 안고 도착한 인플루언서들. 이들이 악명 높은 살인마 '살가죽 가면'과 마주친다. 《텍사스 전기톱 학살》의 속편.,/xVT66OFGCoHXWEzmapPNS1rFX0J.jpg,SazFmUcGrx0
37,58,캐리비안의 해적: 망자의 함,잭 스패로우는 블랙펄을 되찾아 포트 로열을 떠났지만 그를 기다리는 것은 수평선만이 아니었다. 유령선 플라잉 더치맨의 선장 데이비 존스는 잭이 자신에게 피로 진 빚이 있다면서 빚을 갚거나 영혼을 내놓으라고 요구한다. 불행 중 다행한 것은 잭에게 피의 빚 외에도 중매의 은총이 있었다는 것. 결혼을 앞둔 윌 터너와 엘리자베스 스완은 만사를 제쳐두고 옛 친구를 도우러 온다. 잭을 구할 수 있는 단 한 가지 방법은 세상 끝에 있다는 망자의 함을 찾는 것 뿐인데...,/6tD4oT7C01aZLVfoZDz5VFVbJCi.jpg,VFE5rddfXNo
38,698508,리디밍 러브,"올 봄, 이 사랑이 당신을 꿈꾸게 한다!  누구나 품을 수 있지만, 누구도 소유할 수 없는 ‘엔젤’ 단 한 번도 원하는 삶을 살아본 적 없던 그녀에게 운명처럼 오직 그녀를 사랑하는 남자가 나타난다. 무조건적인 그의 사랑에 ‘엔젤’은 매번 도망치지만 조금씩, 그리고 천천히 진정한 세상을 알아가는데…",/sIeWNZkqmMC6gKQMcWvXdXfw6yz.jpg,K0AWAsIZYZo
39,661231,민스미트 작전,"사상 최대의 인명 피해를 낳은 제2차 세계대전, 연합군과 추축군은 전쟁을 승리로 이끌 교두보 시칠리아를 두고 팽팽한 대립을 펼친다. 하지만 추축군 독일의 위세가 상당해 시칠리아에는 이미 추축군 병력 무려 23만 명이 주둔해 있던 상황! 연합군은 해군 정보장교 이웬 몬태규와 찰스 첨리를 주축으로 전쟁의 승기를 잡을 단 한 번의 민스미트 작전을 계획하는데…",/hPNb2m2jgchIpAoyGauol3wZHub.jpg,lQCHll8ido8
40,454626,수퍼 소닉,"소리보다 빠른 초고속 고슴도치 히어로 '소닉'은 지구에 불시착한다. 그의 특별한 능력을 감지한 과학자 ‘닥터 로보트닉’은 세계 정복의 야욕을 채우려 하고, 경찰관 ‘톰’은 위험에 빠진 ‘소닉’을 돕기 위해 나서는데…! 과연, ‘소닉'은 천재 악당에 맞서 지구를 지킬 수 있을까?",/pMXOlasWr1IzHGH8HWw1ZTXs6rQ.jpg,-Sw5qnQVRIM
41,624860,매트릭스: 리저렉션,"토마스 앤더슨은 자신의 현실이 물리적 구성개념인지 아니면 정신적 구성개념인지 알아내기 위해 이번에도 흰 토끼를 따라가야 한다. 토마스, 아니 네오가 배운 게 있다면 비록 환상이라 할지라도 선택이야말로 매트릭스를 탈출할 유일한 길이라는 것이다. 물론 네오는 무엇을 해야 할지 이미 알고 있다. 그가 아직 모르는 사실은 이 새로운 버전의 매트릭스가 그 어느 때보다도 강력하고, 확고부동하고, 위험하다는 것이다.  평범한 일상과 그 이면에 놓여 있는 또 다른 세계, 두 개의 현실이 존재하는 세상에서 운명처럼 인류를 위해 다시 깨어난 구원자 네오. 빨간 약과 파란 약 중 어떤 것을 선택할 것인가?",/AvWlbyLk32HdvSrrSTYpjmXHEXC.jpg,jRZ5V812OZo
42,675445,퍼피 구조대 더 무비,"시민들을 속여 어드벤처 시티의 시장이 된 날씨 악당 `험딩어`는 취임식 당일, 구름을 조종해 천둥번개를 만드는 등 시민들을 위협하며 본모습을 드러낸다. 그런 가운데, 용감한 시민 퍼피 `리버티`로부터 어드벤처 시티가 위험에 빠진 소식을 들은 퍼피 구조대는 신속하게 시티로 출동하는데…! 위기에 빠진 어드벤처 시티의 운명은?",/eCwoA6FoMyvBaO4HB4BzhAKa1Mw.jpg,k_c89Vomf7Y
43,512195,레드 노티스,"인터폴이 중범죄 피의자를 대상으로 내리는 전 세계적 경보인 레드 노티스. 세계 곳곳에서 지명 수배범을 추적하고 체포하는 것이 그 목적이다. 어느 날 초유의 도난 사건이 발생하고, 그로 인해 FBI 최고의 프로파일러(드웨인 존슨)가 라이벌 관계의 두 범죄자(갤 가돗, 라이언 레이놀즈)와 만나면서 모든 게 엇나가기 시작한다. 늘 한발 앞서 도망치는 사기꾼을 잡기 위해 그들은 어쩔 수 없이 싫어도 이를 악물고 힘을 합쳐야 한다. 이제 무슨 일이 일어날지 그 누구도 장담할 수 없다.",/gG06Uu6UQseYaPx1RU2PQjFEUKK.jpg,5EbdgThNoiM
44,299536,어벤져스: 인피니티 워,"타노스는 6개의 인피니티 스톤을 획득해 신으로 군림하려 한다. 그것은 곧 인류의 절반을 학살해 우주의 균형을 맞추겠다는 뜻. 타노스는 닥터 스트레인지가 소유한 타임 스톤, 비전의 이마에 박혀 있는 마인드 스톤을 차지하기 위해 지구를 침략한다. 아이언맨과 스파이더맨은 가디언즈 오브 갤럭시의 멤버들과 타노스를 상대한다. 지구에선 캡틴 아메리카, 완다, 블랙 위도우, 블랙 팬서 등이 비전을 지키기 위해 뭉친다.",/kmP6viwzcEkZeoi1LaVcQemcvZh.jpg,tgManNfbva0
